Topic, Description
Sampling strategy, trees that showed no evidence of past breakage were collected
Leaf area, Leaf area was determined with a scanner (Epson EP Scan GT-8000) combined with an area-determination software (Adobe Photoshop 2.5J.
Stem cross sectional area, It was defined as the geometric mean of the two stem diameters measured.
Height, Measured by a measuring tape.
Crown area, This was calculated as the projection of an ellipse defiend byt eh tow crown diameters.
Biomass, The sample trees were cut into four fractions; leaves, petioles, branches adn stems, that were dried seperately at 80oC for 1 week in an oven and their oven dry mass were measured.
Traits, Species with moderately shade tolerance for all
Growth environment, Under the closed canopies in a primary forest.
